,ID,C_Environment,C_Condition,C_Cycle,C_Trial,C_QuestionNum,C_Question,C_Answer,C_AssignedWait,C_Response,C_QPresent,C_StartRT,C_WaitStart,C_WaitTime,C_TrialLength,C_CycleLength,C_Jitter,C_AverageWait,MC_Correct2205,123,1,1,3,105,480,What imports from a Baja California beach made Gary Drahl a millionaire in late 1975?,Pet Rocks,9.39,S,262.206,9.766,0.547,6.869,17.7,611.0132246,3.86405423,5.008675676,NA2206,123,1,1,3,106,635,What product did Herbert Lapidus invent in 1974 by impregnanting latex rubber with coconut charcoal?,Odor Eaters ,5.806,W,283.851,4.425,0.572,5.811,14.815,611.0132246,1.075990372,5.008675676,02207,123,1,1,3,107,801,What's the only title shared by Oscar-nominated Best Picture and Oscar-nominated best Documentary feature?,Spellbound,3.899,W,299.813,5.495,0.555,3.904,13.963,611.0132246,2.222940858,5.008675676,02208,123,1,1,3,108,545,What is the second oldest continuously held American sporting event?  ,Westminster Kennel Club dog show ,17.795,K,316.059,1.577,0.546,0.694,3.326,611.0132246,3.547720568,5.008675676,02209,123,1,1,3,109,600,What nation is home to the only tunnel in the world longer than the Chunnel?  ,Japan ,5.862,K,322.995,2.265,0.543,1.08,4.396,611.0132246,2.38727554,5.008675676,02210,123,1,1,3,110,739,What was the first song ever performed in outer space? ,Happy Birthday,0.933,W,329.848,3.26,0.551,0.938,8.765,611.0132246,2.359232466,5.008675676,12211,123,1,1,3,111,322,What animal lives in a holt? ,An otter,14.638,W,341.03,1.07,0.568,14.642,20.297,611.0132246,3.280133897,5.008675676,02212,123,1,1,3,112,80,For what crime was Bruno Hauptmann executed in 1936?,Kidnapping and killing the Lindbergh baby,11.817,S,364.664,5.06,0.539,0.62,6.735,611.0132246,2.722496791,5.008675676,NA2213,123,1,1,3,113,822,Where would you find the popular party resort of Magaluf?   ,Majorca,1.043,S,374.191,8.661,0.549,0.611,10.329,611.0132246,1.846166046,5.008675676,NA2214,123,1,1,3,114,460,What game show host took his stage name from the college in his West Virginia hometown? ,Peter Marshall,17.717,S,386.443,5.681,0.553,0.646,7.388,611.0132246,1.355684143,5.008675676,NA2215,123,1,1,3,115,349,"What began as a ligature of the letters ""e"" and ""t""?",Ampersand (&),8.814,K,395.251,9.873,0.54,6.187,17.115,611.0132246,1.880969031,5.008675676,12216,123,1,1,3,116,873,What is the only U.S. state that has a pennant-shaped flag instead of a rectangular one?  ,Ohio,11.064,W,414.339,4.905,0.544,11.068,20.532,611.0132246,3.780470524,5.008675676,02217,123,1,1,3,117,486,"What invention should have made Ts'ai Lun, a second-century inventor, a household name? ",Paper,13.402,W,438.725,3.743,0.553,13.406,21.718,611.0132246,3.627313308,5.008675676,12218,123,1,1,3,118,882,Which of Henry VIII's wives is buried next to him?  ,Jane Seymour ,9.178,W,464.131,0.697,0.54,9.183,14.448,611.0132246,1.551728937,5.008675676,02219,123,1,1,3,119,985,"Whose doghouse apparently contains a basement, a pool table, an Andrew Wyeth painting, and a Jacuzzi?",Snoopy's,3.373,W,480.193,4.163,0.551,3.377,12.124,611.0132246,2.503815575,5.008675676,12220,123,1,1,3,120,84,Gamophobia is the fear of what?,Marriage,15.575,S,494.885,3.775,0.554,1.23,6.067,611.0132246,1.164475618,5.008675676,NA2221,123,1,1,3,121,821,Where would you find the countries of Qumar and Equatorial Kundu? ,On TV's The West Wing ,2.578,W,502.189,6.415,0.555,2.583,13.562,611.0132246,2.544673861,5.008675676,02222,123,1,1,3,122,253,The first suburban shopping center in the U.S. was established in what city?,Kansas City ,17.301,W,518.352,1.924,0.55,17.306,23.791,611.0132246,1.20422907,5.008675676,12223,123,1,1,3,123,927,Who is Jason Schwartzman's famous mother?  ,Talia Shire ,8.603,K,543.407,3.63,0.549,1.074,5.766,611.0132246,1.069192662,5.008675676,02224,123,1,1,3,124,901,What was the only one of his sculptures that Michelangelo signed?  ,The Pieta,13.636,W,550.31,3.062,0.548,13.642,21.267,611.0132246,2.133151202,5.008675676,02225,123,1,1,3,125,400,"What country launched Europe's first super-high-speed passenger train, in 1981?",France,11.817,K,573.776,2.604,0.539,4.405,8.073,611.0132246,3.428893965,5.008675676,12226,123,1,1,3,126,212,Robert Hooke coined what scientific term after looking at a piece of cork under a microscope?,Cell,15.738,W,585.376,3.9,0.546,15.742,24.192,611.0132246,1.400578511,5.008675676,12227,123,2,1,4,127,288,"The world's smallest park, measuring two feet in diameter, is located in what U.S. state? ",Oregon ,1.978,W,0.032,4.23,4.78,1.982,10.771,608.7095468,3.268697464,5.8172,12228,123,2,1,4,128,223,"Student protests in which capital city inspired John Lennon's song  ""Revolution""? ",Paris,5.775,K,14.139,3.411,3.961,2.729,7.205,608.7095468,3.439172659,5.8172,02229,123,2,1,4,129,557,What Italian physician was the first to describe the way the ovaries connect to the uterus in humans?,Gabriele Falloppio ,0.996,S,24.853,5.521,6.067,0.645,7.22,608.7095468,1.00268856,5.8172,NA2230,123,2,1,4,130,485,What Internet portal was sued for copyright infringement in 2000 by the star of Young Einstein? ,Yahoo!,34.009,S,33.143,7.951,8.491,4.18,13.187,608.7095468,1.829603984,5.8172,NA2231,123,2,1,4,131,264,The Linke Scale is used to measure the blueness of what?,The sky,5.246,W,48.219,2.891,3.443,5.251,12.71,608.7095468,3.60875491,5.8172,12232,123,2,1,4,132,14,A conference on safety held at Columbia University's Teacher College in 1939 led to what change? ,School buses were painted yellow,10.978,W,64.6,3.27,3.811,10.983,18.809,608.7095468,1.077849147,5.8172,12233,123,2,1,4,133,558,"What Jack Nicholson comedy was translated as ""Mr. Cat Poop"" in Cantonese when it was released in China?",As Good As It Gets ,14.115,S,84.573,3.361,3.911,1.409,5.833,608.7095468,3.48756249,5.8172,NA2234,123,2,1,4,134,473,What city's harbor is overlooked by Victoria Peak? ,Hong Kong ,35.433,S,93.983,2.687,3.226,20.453,24.185,608.7095468,3.41778048,5.8172,NA2235,123,2,1,4,135,411,What did popular author J.D. Salinger reveal the first two intials in his name to stand for?  ,Juvenile deliquent,3.03,S,121.679,2.615,3.159,1.744,5.415,608.7095468,1.663901047,5.8172,NA2236,123,2,1,4,136,200,On what namesake Asian island were the first Homo erectus fossils found? ,Java,2.105,W,128.832,6.062,6.602,2.11,12.726,608.7095468,3.382419011,5.8172,12237,123,2,1,4,137,270,"The pinna is the outer, visible part of what?",The ear,30.15,S,144.995,2.827,3.376,16.45,20.341,608.7095468,2.321217518,5.8172,NA2238,123,2,1,4,138,260,The Italian government regulates the price of what beverage?,Espresso,0.651,W,167.743,3.271,3.827,0.656,8.497,608.7095468,2.653841647,5.8172,12239,123,2,1,4,139,285,"The world's first ""sister cities"" were what Spanish city and its midwestern namesake?",Toledo,50.528,S,178.958,4.328,4.881,14.455,19.839,608.7095468,2.740284405,5.8172,NA2240,123,2,1,4,140,602,What New York country club lent its name to the kind of dinner jacket first worn there in 1886?  ,Tuxedo Club ,9.432,K,201.606,6.488,7.053,4.01,11.582,608.7095468,1.700623028,5.8172,02241,123,2,1,4,141,413,What did Ross and Norris McWhirter compile as a promotional giveaway in 1955? ,The Guinness Book of World Records,1.993,S,214.961,1.493,2.039,0.493,3.042,608.7095468,2.443581582,5.8172,NA2242,123,2,1,4,142,765,What were the first modern Olympic pole vaulters' poles made of? ,Bamboo ,21.193,S,220.51,2.376,2.925,6.842,10.279,608.7095468,3.302505673,5.8172,NA2243,123,2,1,4,143,181,"James Bond works for M, but what single initial is used for the real-life director of Britain's MI6?",C,39.37,S,234.182,8.447,9.026,0.877,10.413,608.7095468,1.550131696,5.8172,NA2244,123,2,1,4,144,944,Who provided the voice for cartoon character Inspector Gadget? ,Don Adams,8.887,S,246.217,3.981,4.529,6.147,11.181,608.7095468,1.767199393,5.8172,NA2245,123,2,1,4,145,664,What snack food is an ingredient in the explosive dynamite?  ,Peanuts ,27.486,S,259.254,3.536,4.078,16.809,21.394,608.7095468,2.287969874,5.8172,NA2246,123,2,1,4,146,75,"Europe's only free-range monkeys are the Barbary apes, which live where?",Gibralter,42.521,S,283.021,3.936,4.479,15.849,20.842,608.7095468,2.477909395,5.8172,NA2247,123,2,1,4,147,698,What element is combined with oxygen to make up the mineral quartz?,Silicon,5.714,S,306.422,3.304,3.844,5.548,9.928,608.7095468,2.985035323,5.8172,NA2248,123,2,1,4,148,185,Mohammed Khatami is both a former national librarian and a former president of what nation?,Iran,1.603,W,319.408,5.589,6.134,1.607,11.757,608.7095468,1.043417119,5.8172,12249,123,2,1,4,149,500,"What is called the ""bark lion sentinel dog"" in its native Tibet?  ",Lhasa Apso,89.409,S,332.262,4.736,5.282,10.942,16.73,608.7095468,2.075206241,5.8172,NA2250,123,2,1,4,150,6,Project Kansas was the name for the top secret 1985 attempt to revamp what product?,Coca-Cola,3.789,W,351.149,2.625,3.176,3.794,10.987,608.7095468,1.570512429,5.8172,12251,123,2,1,4,151,724,"What was originally sold in 1965 under the name ""Chemgrass""?  ",AstroTurf ,10.67,S,363.768,2.502,3.042,7.171,10.73,608.7095468,2.175285804,5.8172,NA2252,123,2,1,4,152,931,Who is pictured on a US Purple Heart medal? ,George Washington,1.687,S,376.755,3.475,4.028,1.158,5.699,608.7095468,1.207730527,5.8172,NA2253,123,2,1,4,153,20,"According to Norse sagas, who gave Greenland its misleading name in order to attract settlers? ",Eric the Red,0.347,W,383.742,6.016,6.569,0.351,10.954,608.7095468,1.878443866,5.8172,02254,123,2,1,4,154,585,What metal was found in Nevada's famed Comstock Lode?  ,Silver,42.371,S,396.629,2.193,2.741,2.404,5.649,608.7095468,1.812846871,5.8172,NA2255,123,2,1,4,155,331,What are Quivira and Cibola?  ,Two of the seven cities of gold,32.316,S,404.183,2.167,2.708,0.035,3.259,608.7095468,1.179378884,5.8172,NA2256,123,2,1,4,156,731,What was the first American novel to sell one million copies? ,Uncle Tom's Cabin ,2.365,W,408.696,2.198,2.741,2.37,9.115,608.7095468,1.319633699,5.8172,12257,123,2,1,4,157,824,"Which accidentally invented household items were first marketed as ""friction lights""? ",Matches,2.096,W,419.193,2.749,3.293,2.1,9.4,608.7095468,2.846202033,5.8172,12258,123,2,1,4,158,47,Bauxite ore is mined so it can be processed into what metal?,Aluminum,39.37,S,431.494,4.511,5.064,1.455,7.036,608.7095468,1.393569352,5.8172,NA2259,123,2,1,4,159,108,Ida May Fuller was the first U.S. citizen to receive a check for what?,Social Security,4.952,W,439.985,1.925,2.474,4.957,11.439,608.7095468,1.023969078,5.8172,12260,123,2,1,4,160,208,"Pink Floyd's ""Chapter 24"" was inspired by what literary work?",The I Ching,26.58,S,452.504,1.398,1.939,0.786,3.242,608.7095468,1.549334279,5.8172,NA2261,123,2,1,4,161,661,What slightly hallucinogenic spice did Malcolm X use to get high while in prison? ,Nutmeg,2.105,W,457.368,2.286,2.825,2.11,8.948,608.7095468,2.051490137,5.8172,12262,123,2,1,4,162,160,"In what nation did the woven-yarn craft of ""God's eyes"" originate? ",Mexico ,4.672,S,468.433,2.829,3.376,0.212,4.094,608.7095468,1.315479494,5.8172,NA2263,123,2,1,4,163,110,In 1568 the Catholic Church sentenced the entire population of which nation to death as heretics?,The Netherlands,64.222,S,473.915,3.763,4.312,32.386,37.222,608.7095468,1.169462438,5.8172,NA2264,123,2,1,4,164,504,What is measured in becquerels? ,Radioactivity,30.628,S,512.375,1.847,2.407,1.032,3.944,608.7095468,1.544694559,5.8172,NA2265,123,2,1,4,165,672,What sports term is the shortest word ever to decide the National Spelling Bee?   ,Luge,1.801,W,517.957,6.065,6.619,1.806,12.442,608.7095468,2.451321882,5.8172,12266,123,2,1,4,166,807,"When asked to define ""cool,"" what two words did James Brown use? ",James Brown,7.643,K,532.933,2.385,2.925,4.339,7.772,608.7095468,3.794571037,5.8172,02267,123,2,1,4,167,906,Who beat Robert Scott by a month in his expedition to the South Pole? ,Roald Amundsen ,40.344,S,544.583,3.695,4.279,1.391,6.184,608.7095468,2.171966126,5.8172,NA2268,123,2,1,4,168,811,"Where did the abbreviation ""INRI"" traditionally appear? ",On Christ's crucifix ,20.071,K,553.024,2.062,2.591,0.487,3.593,608.7095468,3.845169672,5.8172,02269,123,2,1,4,169,982,Whom did the Daughters of the American Revolution bar from singing at Constitution Hall in 1936?,Marian Anderson,1.655,W,560.545,3.157,3.711,1.661,9.383,608.7095468,1.578298471,5.8172,02270,123,2,1,4,170,292,"Though the rest of him lies in Westminster Abbey, what writer's heart is buried near his native Dorchester?",Thomas Hardy,60.827,K,571.577,3.685,4.229,1.112,5.849,608.7095468,2.152496604,5.8172,02271,123,2,1,4,171,552,"What is unusual about the ""in God We Trust"" Motto on the U.S. Mint's recent presidential dollar coins?",It's stamped on the coin's edge,20.071,W,579.65,4.38,4.931,20.077,29.022,608.7095468,1.68619711,5.8172,12272,122,2,2,1,1,526,What is the name of the ship that carried Captain Cook to Australia?  ,Endeavour ,26.89,S,0.098,1.49,0.533,4.594,7.141,600.360912,1.694734213,7.824242424,NA2273,122,2,2,1,2,225,Tasseomancy is a method of fortune telling that primarily uses what? ,Tea leaves,15.197,W,9.107,7.247,0.559,15.207,27.035,600.360912,3.624990818,7.824242424,12274,122,2,2,1,3,985,"Whose doghouse apparently contains a basement, a pool table, an Andrew Wyeth painting, and a Jacuzzi?",Snoopy's,0.52,NA,39.878,NA,NA,NA,NA,600.360912,1.376999299,7.824242424,NA2275,122,2,2,1,4,231,The Admiral is which type of insect? ,Butterfly,7.139,W,52.397,3.517,0.545,7.145,15.216,600.360912,1.597781146,7.824242424,12276,122,2,2,1,5,751,"What was the one question Sigmund Freud said he was unable to answer, despite 30 years of research?",What do women want? ,0.553,W,69.312,4.114,0.55,0.559,9.233,600.360912,3.209515348,7.824242424,02277,122,2,2,1,6,834,"Which animal's poison could kill up to 2,200 people? ",Poison-arrow frog,2.489,W,81.847,4.321,0.559,2.495,11.389,600.360912,1.895480811,7.824242424,12278,122,2,2,1,7,187,Ninety percent of the world's true cinnamon comes from what island nation? ,Sri Lanka,9.002,W,95.202,4.663,0.552,9.008,18.242,600.360912,1.787793912,7.824242424,12279,122,2,2,1,8,440,What famed TV personality wrote the screenplay for 1968's Planet of the Apes? ,Rod Serling ,39.522,S,115.309,5.203,0.547,2.118,8.374,600.360912,2.76745304,7.824242424,NA2280,122,2,2,1,9,855,Which country did the Easter Bunny originate from? ,Germany,1.941,W,126.541,2.219,0.555,1.946,8.731,600.360912,1.138343357,7.824242424,12281,122,2,2,1,10,110,In 1568 the Catholic Church sentenced the entire population of which nation to death as heretics?,The Netherlands,8.586,K,136.52,5.514,0.536,0.798,7.372,600.360912,3.344958153,7.824242424,02282,122,2,2,1,11,894,Which species of snake gives birth to its young instead of laying eggs?  ,Anaconda,36.069,S,147.351,4.93,0.552,2.128,8.123,600.360912,2.24565749,7.824242424,NA2283,122,2,2,1,12,900,Which U.S. state's leading public university is the only one not to be named for the state?  ,New Jersey's Rutgers,3.192,W,157.814,7.531,0.542,3.197,15.283,600.360912,1.12482544,7.824242424,12284,122,2,2,1,13,433,What EU nation was once led by a president and a prime minister who were identical twins? ,Poland,8.586,W,174.294,4.034,0.545,8.592,17.189,600.360912,3.435722612,7.824242424,02285,122,2,2,1,14,987,"Whose epitaph read in part, ""Here lies one whose name was writ in water?  ",John Keats ,1.084,W,195.003,3.966,0.547,1.09,9.617,600.360912,1.822804239,7.824242424,12286,122,2,2,1,15,847,Which cartoonist is famous for creating the popular image of Santa Claus? ,Thomas Nast ,2.489,W,206.536,2.921,0.539,2.494,9.969,600.360912,3.186677312,7.824242424,02287,122,2,2,1,16,556,What islands are home to most of the world's blue-footed boobies? ,The Galapagos Islands ,43.675,W,219.79,4.978,0.554,43.681,53.225,600.360912,2.42424786,7.824242424,12288,122,2,2,1,17,890,Which popular treat was invented by an 11-year-old in California? ,The popsicle,0.575,W,275.516,3.453,0.558,0.58,8.597,600.360912,2.566438344,7.824242424,12289,122,2,2,1,18,521,What is the most sober school according to The Princeton Review? ,Brigham Young University,3.657,W,286.765,3.932,0.547,3.662,12.157,600.360912,1.860887973,7.824242424,12290,122,2,2,1,19,511,What is the deepest point of the Mariana Trench?,Challenger Deep ,12.631,S,300.855,3.042,0.552,1.664,5.766,600.360912,1.549632378,7.824242424,NA2291,122,2,2,1,20,753,What was the only children's story ever published by James Bond creator Ian Fleming? ,Chitty Chitty Bang Bang ,31.791,S,308.259,5.013,0.552,16.239,22.313,600.360912,2.601808673,7.824242424,NA2292,122,2,2,1,21,497,What is an esker? ,A glacial ridge,7.414,S,333.281,4.008,0.555,1.076,6.15,600.360912,1.566261513,7.824242424,NA2293,122,2,2,1,22,585,What metal was found in Nevada's famed Comstock Lode?  ,Silver,1.351,S,341.086,6.515,0.539,0.468,8.039,600.360912,1.108035876,7.824242424,NA2294,122,2,2,1,23,306,What 1980 film is named for the legendary square-shaped capital of Kublai Khan? ,Xanadu ,65.543,S,350.329,6.967,0.554,0.365,8.39,600.360912,1.664229205,7.824242424,NA2295,122,2,2,1,24,654,"What school has the most students over age 25, according to U.S. News & World Report?",University of Phoenix,8.59,W,360.475,3.894,0.552,8.595,17.055,600.360912,1.015825381,7.824242424,12296,122,2,2,1,25,9,"White Christmas playing on Armed Forces Radio was the secret signal for what event on April 30, 1975?",The evacuation of Saigon,65.543,S,378.643,8.303,0.539,50.723,60.071,600.360912,3.255423398,7.824242424,NA2297,122,2,2,1,26,903,"Which Yellowstone geyser, with eruptions 100 fee taller than Old Faithful's, is the world's tallest?",Steamboat Geyser,6.625,S,442.057,5.055,0.544,0.775,6.886,600.360912,2.154078881,7.824242424,NA2298,122,2,2,1,27,264,The Linke Scale is used to measure the blueness of what?,The sky,1.546,S,451.183,2.601,0.541,0.762,4.412,600.360912,1.308469482,7.824242424,NA2299,122,2,2,1,28,836,Which animals are born pregnant and can give birth 10 days after being born themselves?  ,Aphids,22.537,W,456.983,3.241,0.553,22.542,30.343,600.360912,1.718862695,7.824242424,02300,122,2,2,1,29,742,What was the game of Scrabble originally called? ,Criss-Cross ,1.378,W,489.125,2.708,0.551,1.383,8.647,600.360912,1.135190902,7.824242424,12301,122,2,2,1,30,733,What was the first CD pressed for commerical release in the U.S.?,Bruce Springsteen's Born in the USA ,17.396,S,499.003,4.046,0.55,8.177,13.287,600.360912,1.41138013,7.824242424,NA2302,122,2,2,1,31,164,"In what state was the U.S.'s first ""Adopt-a-Highway"" program started?",Texas,25.86,S,513.795,5.846,0.539,24.764,31.656,600.360912,2.813528632,7.824242424,NA2303,122,2,2,1,32,948,"Who solves crimes in Bayport, located on Barmet Bay? ",The Hardy Boys ,4.936,S,548.343,3.601,0.561,0.487,5.181,600.360912,3.05244548,7.824242424,NA2304,122,2,2,1,33,377,"What city is home to the world's very first pet cemetery, in which Rin Tin Tin is buried?",Paris,8.291,W,556.684,3.589,0.54,8.295,16.436,600.360912,2.401453868,7.824242424,12305,122,2,2,1,34,844,"Which British novelist said, ""Fame is a powerful aphrodisiac""?",Graham Greene,2.875,W,575.604,3.78,0.549,2.88,11.222,600.360912,1.7579525,7.824242424,02306,122,2,2,1,35,595,What name is given to an eagle's nest?   ,Aerie,0.504,W,588.692,2.789,0.554,0.509,7.862,600.360912,1.458877777,7.824242424,12307,122,2,2,1,36,895,Which state has the zip code 12345?,New York,24.973,NA,598.085,NA,NA,NA,NA,600.360912,3.701044408,7.824242424,NA2308,122,1,2,2,37,275,"The SS Faith, a ship built by Leslie Comyn, was made of what unique material?",Cement,8.347,S,0.027,4.896,0.536,2.446,8.391,602.5712856,1.212228413,7.5075625,NA2309,122,1,2,2,38,331,What are Quivira and Cibola?  ,Two of the seven cities of gold,2.789,W,9.721,2.68,0.53,2.796,10.02,602.5712856,1.042232941,7.5075625,02310,122,1,2,2,39,542,What is the only type of lizard that has a voice? ,Gecko,16.213,S,20.853,2.621,0.555,5.036,8.725,602.5712856,2.287308097,7.5075625,NA2311,122,1,2,2,40,75,"Europe's only free-range monkeys are the Barbary apes, which live where?",Gibralter,11.534,S,31.968,5.249,0.551,8.625,14.942,602.5712856,2.531907007,7.5075625,NA2312,122,1,2,2,41,534,What is the only English word with three consecutive double letters?  ,Bookkeeper,10.168,NA,49.551,NA,NA,NA,NA,602.5712856,3.287329917,7.5075625,NA2313,122,1,2,2,42,216,"Shakespeare mentioned his wife only once in his will, making her the odd bequest of his ""second best"" what? ",Bed ,17.417,W,63.976,6.946,0.559,17.421,28.939,602.5712856,2.102791393,7.5075625,12314,122,1,2,2,43,850,Which chess piece was originally called 'the elephant'? ,The bishop,2.048,W,95.098,3.279,0.548,2.054,9.884,602.5712856,1.220595353,7.5075625,12315,122,1,2,2,44,227,"The ""Mohorovicic discontinuity"" divides what two outer layers of the earth?",The crust and the mantle,7.554,S,106.296,5.521,0.546,0.796,7.371,602.5712856,3.039982102,7.5075625,NA2316,122,1,2,2,45,604,"What noisy word comes from the capital of Hell in Milton's ""Paradise Lost""? ",Pandemonium,11.965,W,116.793,5.08,0.552,11.97,21.618,602.5712856,1.801671159,7.5075625,02317,122,1,2,2,46,898,"Which U.S. president declared the first national ""Mother's Day""?  ",Woodrow Wilson ,15.98,W,140.377,3.272,0.555,15.986,23.824,602.5712856,1.124349978,7.5075625,02318,122,1,2,2,47,24,"According to Thomas Malory, Sir Bedivere's last knightly act was to return what to a lake?",Excalibur,5.421,S,165.465,5.096,0.553,0.862,7.019,602.5712856,2.71518851,7.5075625,NA2319,122,1,2,2,48,906,Who beat Robert Scott by a month in his expedition to the South Pole? ,Roald Amundsen ,3.428,S,175.276,2.885,0.558,1.017,4.963,602.5712856,2.119523297,7.5075625,NA2320,122,1,2,2,49,260,The Italian government regulates the price of what beverage?,Espresso,8.755,W,182.464,3.121,0.539,8.76,16.436,602.5712856,3.178485453,7.5075625,12321,122,1,2,2,50,620,"What pet bird takes its name from Australian Aborigine words for ""good eating""?",The budgerigar,3.084,S,202.153,6.712,0.558,0.713,8.49,602.5712856,3.79472345,7.5075625,NA2322,122,1,2,2,51,210,Prime Minister Lester Pearson won the Nobel Peace Prize for defusing what world crisis?,The Suez Crisis,19.77,W,214.522,3.384,0.544,19.776,27.736,602.5712856,1.80616849,7.5075625,12323,122,1,2,2,52,944,Who provided the voice for cartoon character Inspector Gadget? ,Don Adams,12.873,W,244.156,3.413,0.548,12.878,20.85,602.5712856,1.722489968,7.5075625,02324,122,1,2,2,53,237,"The average male spends 2,965 hours doing what over the course of his lifetime?",Shaving,2.712,W,266.821,4.477,0.554,2.717,11.773,602.5712856,2.436305319,7.5075625,12325,122,1,2,2,54,768,"What whiskey cocktail lends its name to the short glass also called a ""lowball""?",The old-fashioned,15.656,W,281.111,6.314,0.556,15.661,26.549,602.5712856,3.014321863,7.5075625,12326,122,1,2,2,55,670,What spice is named for the capital of French Guiana? ,Cayenne pepper ,11.942,W,310.746,9.064,0.547,11.947,25.579,602.5712856,3.82193497,7.5075625,12327,122,1,2,2,56,927,Who is Jason Schwartzman's famous mother?  ,Talia Shire ,7.35,S,340.23,3.268,0.543,0.872,5.198,602.5712856,2.065028296,7.5075625,NA2328,122,1,2,2,57,342,What athlete acted in the movie Old Yeller? ,Chuck Connors,3.085,S,347.584,2.865,0.545,0.463,4.379,602.5712856,1.142061077,7.5075625,NA2329,122,1,2,2,58,203,"One in every 2,000 babies is born with what? ",Teeth,8.474,W,353.183,2.73,0.546,8.478,15.769,602.5712856,3.06852051,7.5075625,12330,122,1,2,2,59,449,What fictional island is constantly at war with Blefuscu over the correct way to eat a boiled egg?,Lilliput,15.92,S,372.121,6.944,0.543,0.832,8.825,602.5712856,2.132712106,7.5075625,NA2331,122,1,2,2,60,414,What did the letter Q originally stand for in NASDAQ?  ,Quotations ,11.942,W,383.185,5.087,0.545,11.947,21.585,602.5712856,1.504740392,7.5075625,12332,122,1,2,2,61,300,"Venetian painter Jacopo Robusti was better known by what name, because he was the son of a cloth dyer?",Tintoretto,12.495,S,406.385,3.648,0.547,0.724,5.431,602.5712856,1.876991694,7.5075625,NA2333,122,1,2,2,62,664,What snack food is an ingredient in the explosive dynamite?  ,Peanuts ,16.192,W,413.773,5.364,0.552,16.196,26.147,602.5712856,2.38295725,7.5075625,12334,122,1,2,2,63,951,Who was assassinated by Carl Weiss?  ,Huey Long,1.355,S,442.387,2.118,0.54,1.235,4.413,602.5712856,3.456796864,7.5075625,NA2335,122,1,2,2,64,957,Who was sent to the electric chair on the testimony of her brother David Greenglass?,Ether Rosenberg ,4.952,S,450.36,3.449,0.546,0.989,5.498,602.5712856,2.177314134,7.5075625,NA2336,122,1,2,2,65,286,"The world's largest church is Our Lady of Peace Basilica in Yamoussoukro, what nation's capital?",Ivory Coast's ,4.129,NA,458.115,NA,NA,NA,NA,602.5712856,1.966319334,7.5075625,NA2337,122,1,2,2,66,853,Which Constitutional Amendment deals with income tax? ,Sixteenth,19.267,W,471.22,5.518,0.566,19.272,29.373,602.5712856,3.538662844,7.5075625,12338,122,1,2,2,67,969,Who was the only U.S. president to also hold a patent for an invention?,Abraham Lincoln,7.392,K,504.264,6.089,0.546,4.317,11.467,602.5712856,1.238216151,7.5075625,02339,122,1,2,2,68,799,What's the only stock from the original Dow Jones Industrial Average that's still used in computing the index?,General Electric ,10.457,W,517.05,7.663,0.544,10.462,22.688,602.5712856,1.635345536,7.5075625,12340,122,1,2,2,69,223,"Student protests in which capital city inspired John Lennon's song  ""Revolution""? ",Paris,8.347,W,541.453,5.1,0.549,8.352,18.008,602.5712856,3.64510711,7.5075625,12341,122,1,2,2,70,873,What is the only U.S. state that has a pennant-shaped flag instead of a rectangular one?  ,Ohio,16.08,W,563.182,7.124,0.548,16.085,27.769,602.5712856,1.661847709,7.5075625,12342,122,1,2,2,71,84,Gamophobia is the fear of what?,Marriage,2.869,W,592.682,2.399,0.543,2.874,9.834,602.5712856,3.719030738,7.5075625,12343,122,2,2,3,72,967,Who was the only person to be nearby at three different presidential assassinations? ,Robert Lincoln ,88.201,S,0.024,5.424,0.543,25.432,31.907,645.3891742,1.436418677,16.9276087,NA