,ID,C_Environment,C_Condition,C_Cycle,C_Trial,C_QuestionNum,C_Question,C_Answer,C_AssignedWait,C_Response,C_QPresent,C_StartRT,C_WaitStart,C_WaitTime,C_TrialLength,C_CycleLength,C_Jitter,C_AverageWait,MC_Correct1090,115,2,1,4,176,289,"'Thimpu, the capital of Bhutan, is known for being the only world capital without any what?'",'Traffic lights',2.326,S,541.6903291,1.259,1.805,1.333,3.643,602.0751915,1.154011085,3.601046512,NA1091,115,2,1,4,177,300,"'Venetian painter Jacopo Robusti was better known by what name, because he was the son of a cloth dyer?'",'Tintoretto',25.045,S,546.5541258,4.715,5.265,0.785,6.569,602.0751915,1.281704682,3.601046512,NA1092,115,2,1,4,178,784,'What''s the more common name for the retinal scotoma caused by the optic nerve? ','Your blind spot',21.302,S,554.4766961,5.608,6.151,4.385,11.048,602.0751915,3.138808074,3.601046512,NA1093,115,2,1,4,179,317,'What album spent a record 741 weeks on Billboard''s Top 200 Albums chart? ','Dark Side of the Moon',1.184,W,568.7341408,2.327,2.875,1.189,8.079,602.0751915,1.840681999,3.601046512,11094,115,2,1,4,180,932,'Who is Rashida Jones''s famous mother?','Peggy Lipton ',3.815,W,578.7125644,1.605,2.156,3.82,9.985,602.0751915,1.55992964,3.601046512,01095,115,2,1,4,181,212,'Robert Hooke coined what scientific term after looking at a piece of cork under a microscope?','Cell',12.763,K,590.3121297,7.893,8.441,0.379,9.326,602.0751915,2.369251561,3.601046512,01120,117,1,1,1,1,433,What EU nation was once led by a president and a prime minister who were identical twins? ,Poland,15.063,NA,0.247,NA,NA,NA,NA,602.7348041,2.394949471,7.897382353,NA1121,117,1,1,1,2,654,"What school has the most students over age 25, according to U.S. News & World Report?",University of Phoenix,5.575,S,13.82,3.095,0.548,1.486,5.651,602.7348041,2.424551964,7.897382353,NA1122,117,1,1,1,3,331,What are Quivira and Cibola?  ,Two of the seven cities of gold,6.855,W,21.976,3.869,0.544,6.864,15.285,602.7348041,2.089992261,7.897382353,01123,117,1,1,1,4,286,"The world's largest church is Our Lady of Peace Basilica in Yamoussoukro, what nation's capital?",Ivory Coast's ,16.759,W,39.442,4.098,0.548,16.765,25.429,602.7348041,2.433528851,7.897382353,01124,117,1,1,1,5,85,Greeks consider which day of the week the unluckiest because it is the day that Constantinople fell in 1453? ,Tuesday,19.282,W,67.405,3.982,0.547,19.287,27.836,602.7348041,1.170185484,7.897382353,11125,117,1,1,1,6,661,What slightly hallucinogenic spice did Malcolm X use to get high while in prison? ,Nutmeg,13.643,W,96.488,3.004,0.54,13.648,21.2,602.7348041,1.985331359,7.897382353,11126,117,1,1,1,7,890,Which popular treat was invented by an 11-year-old in California? ,The popsicle,8.265,W,119.755,2.568,0.54,8.27,15.384,602.7348041,3.783239878,7.897382353,11127,117,1,1,1,8,739,What was the first song ever performed in outer space? ,Happy Birthday,2.775,S,138.993,2.714,0.545,2.055,5.833,602.7348041,1.792315666,7.897382353,NA1128,117,1,1,1,9,335,"What are you trying to remember if you use the mnemonic ""HOMES""?  ",The names of the Great Lakes ,12.654,K,146.698,3.785,0.544,0.944,5.784,602.7348041,3.532768254,7.897382353,11129,117,1,1,1,10,292,"Though the rest of him lies in Westminster Abbey, what writer's heart is buried near his native Dorchester?",Thomas Hardy,18.821,W,156.109,6.408,0.545,18.826,29.792,602.7348041,1.35162766,7.897382353,01130,117,1,1,1,11,821,Where would you find the countries of Qumar and Equatorial Kundu? ,On TV's The West Wing ,9.862,S,187.331,3.913,0.55,0.665,5.632,602.7348041,2.000240258,7.897382353,NA1131,117,1,1,1,12,264,The Linke Scale is used to measure the blueness of what?,The sky,1.357,W,195.053,3.07,0.54,1.362,8.982,602.7348041,1.032151462,7.897382353,11132,117,1,1,1,13,445,What famous philanthropist was the only Treasury secretary ever to serve under three presidents? ,Andrew Mellon,6.211,W,205.149,5.759,0.542,6.217,16.537,602.7348041,2.06768494,7.897382353,01133,117,1,1,1,14,558,"What Jack Nicholson comedy was translated as ""Mr. Cat Poop"" in Cantonese when it was released in China?",As Good As It Gets ,14.459,S,223.852,3.216,0.545,0.862,5.131,602.7348041,1.78219174,7.897382353,NA1134,117,1,1,1,15,844,"Which British novelist said, ""Fame is a powerful aphrodisiac""?",Graham Greene,19.793,S,230.872,3.372,0.54,0.924,5.348,602.7348041,2.472823013,7.897382353,NA1135,117,1,1,1,16,877,"Which mammal is the world's smallest, weighing less than a penny? ",Bumblebee bat,9.45,W,238.778,2.642,0.551,9.455,16.654,602.7348041,2.281347164,7.897382353,11136,117,1,1,1,17,585,What metal was found in Nevada's famed Comstock Lode?  ,Silver,0.659,W,257.799,3.525,0.553,0.664,8.748,602.7348041,1.645953757,7.897382353,11137,117,1,1,1,18,733,What was the first CD pressed for commerical release in the U.S.?,Bruce Springsteen's Born in the USA ,15.969,W,268.279,2.357,0.535,15.975,22.872,602.7348041,1.881236618,7.897382353,01138,117,1,1,1,19,554,What island in Manila Bay was the site of a famous 1942 siege?  ,Corregidor,14.335,S,293.133,2.231,0.544,1.815,5.098,602.7348041,1.137788351,7.897382353,NA1139,117,1,1,1,20,901,What was the only one of his sculptures that Michelangelo signed?  ,The Pieta,9.621,W,299.451,1.977,0.547,9.626,16.169,602.7348041,2.238589398,7.897382353,11140,117,1,1,1,21,852,Which Constitutional Amendment deals with poll taxes? ,Twenty-fourth ,9.721,W,317.937,3.795,0.551,9.726,18.091,602.7348041,1.143655885,7.897382353,11141,117,1,1,1,22,288,"The world's smallest park, measuring two feet in diameter, is located in what U.S. state? ",Oregon ,14.335,W,337.276,3.952,0.544,14.339,22.856,602.7348041,1.273103358,7.897382353,11142,117,1,1,1,23,893,Which space shuttle is named for the ship on which Robert Scott first sailed to Antarctica? ,The Discovery,2.244,S,361.478,3.165,0.545,1.214,5.432,602.7348041,1.715093574,7.897382353,NA1143,117,1,1,1,24,521,What is the most sober school according to The Princeton Review? ,Brigham Young University,16.386,W,368.715,3.144,0.55,16.392,24.092,602.7348041,1.315421282,7.897382353,11144,117,1,1,1,25,527,What is the national tree of Jamaica? ,The Blue Mahoe ,12.083,W,394.205,1.775,0.549,12.088,18.426,602.7348041,2.802671906,7.897382353,11145,117,1,1,1,26,300,"Venetian painter Jacopo Robusti was better known by what name, because he was the son of a cloth dyer?",Tintoretto,16.411,S,415.516,2.696,0.547,1.349,5.097,602.7348041,1.496862997,7.897382353,NA1146,117,1,1,1,27,231,The Admiral is which type of insect? ,Butterfly,6.488,S,422.201,1.914,0.56,1.04,4.027,602.7348041,1.893296849,7.897382353,NA1147,117,1,1,1,28,113,"In 1802, John Beckley became the librarian of what collection containing 740 books at the time?",Library of Congress,5.991,W,428.219,5.033,0.549,5.997,15.584,602.7348041,3.513734926,7.897382353,11148,117,1,1,1,29,853,Which Constitutional Amendment deals with income tax? ,Sixteenth,10.405,W,447.39,2.078,0.547,10.41,17.038,602.7348041,2.614035251,7.897382353,11149,117,1,1,1,30,20,"According to Norse sagas, who gave Greenland its misleading name in order to attract settlers? ",Eric the Red,11.362,S,467.113,4.355,0.543,1.009,6.417,602.7348041,3.210160296,7.897382353,NA1150,117,1,1,1,31,895,Which state has the zip code 12345?,New York,1.878,W,476.807,3.284,0.543,1.883,9.717,602.7348041,1.878185009,7.897382353,11151,117,1,1,1,32,158,"In what layer of the Earth's atmosphere is Antarctica's famed ""ozone hole""? ",Stratosphere,17.543,K,488.49,4.081,0.549,1.458,6.602,602.7348041,1.675307919,7.897382353,11152,117,1,1,1,33,423,What does an anemometer measure? ,Speed of wind,7.41,W,496.848,2.284,0.541,7.414,14.247,602.7348041,2.842677938,7.897382353,11153,117,1,1,1,34,38,A umiak is a larger version of what? ,Kayak,18.719,W,514.047,2.149,0.542,18.724,25.429,602.7348041,3.105516689,7.897382353,11154,117,1,1,1,35,642,What restaurant chain was the brainchild of Atari founder Nolan Bushnell? ,Chuck E. Cheese's,5.309,W,542.662,4.789,0.542,5.314,14.665,602.7348041,1.010768488,7.897382353,11155,117,1,1,1,36,396,"What can be built by the largest Lego set ever sold, a 5195-piece monstrosity? ",The Millenium Falcon ,15.699,W,558.423,3.916,0.546,15.704,24.176,602.7348041,1.411649539,7.897382353,11156,117,1,1,1,37,857,Which country has the most public libraries?  ,Russia,11.137,W,584.08,1.516,0.54,11.142,17.206,602.7348041,1.337402136,7.897382353,11157,117,2,1,2,38,87,Har Gobind Khorana won the 1968 Nobel Prize for Medicine for research into what?,Genetics,4.3,W,0.027,3.336,3.878,4.308,12.193,625.725129,2.923095157,13.67146429,11158,117,2,1,2,39,873,What is the only U.S. state that has a pennant-shaped flag instead of a rectangular one?  ,Ohio,2.038,W,15.237,3.356,3.911,2.042,9.968,625.725129,1.498665194,13.67146429,11159,117,2,1,2,40,289,"Thimpu, the capital of Bhutan, is known for being the only world capital without any what?",Traffic lights,30.249,S,26.787,3.302,3.844,1.041,5.4,625.725129,1.827349504,13.67146429,NA1160,117,2,1,2,41,499,"What is believed to have received its name from the Portuguese word for ""simpleton""? ",The dodo,1.28,W,34.107,4.677,5.232,1.286,10.554,625.725129,1.748865779,13.67146429,11161,117,2,1,2,42,72,"Each year, approximately 125 people die of what? ",Choking on food,64.409,W,46.493,2.02,2.574,64.414,70.992,625.725129,2.60679856,13.67146429,11162,117,2,1,2,43,453,"What former president coined the phrase ""lunatic fringe"" to refer to the wackos in his own reform movement?",Theodore Roosevelt ,20.204,S,120.17,3.879,4.429,1.025,5.967,625.725129,1.254773384,13.67146429,NA1163,117,2,1,2,44,591,"What molecule is named for the Greek word for ""smell,"" because of the odor associated with lightning storms?",Ozone,7.524,W,127.457,2.927,3.477,7.529,15.016,625.725129,1.934803763,13.67146429,11164,117,2,1,2,45,534,What is the only English word with three consecutive double letters?  ,Bookkeeper,5.771,W,144.489,3.407,3.961,5.776,13.746,625.725129,2.123862606,13.67146429,11165,117,2,1,2,46,485,What Internet portal was sued for copyright infringement in 2000 by the star of Young Einstein? ,Yahoo!,0.12,W,160.451,3.253,3.794,0.125,7.929,625.725129,3.557671705,13.67146429,11166,117,2,1,2,47,220,Songbird is a book about what jazz singer's remarkable posthumous career? ,Eva Cassidy ,71.198,W,172.018,3.679,4.229,71.203,79.45,625.725129,1.63403676,13.67146429,01167,117,2,1,2,48,833,Which animal's milk does not curdle? ,Camel,21.108,W,253.216,1.728,2.273,21.113,27.401,625.725129,1.596888147,13.67146429,11168,117,2,1,2,49,557,What Italian physician was the first to describe the way the ovaries connect to the uterus in humans?,Gabriele Falloppio ,11.862,S,282.299,3.389,3.944,1.036,5.499,625.725129,1.458072362,13.67146429,NA1169,117,2,1,2,50,24,"According to Thomas Malory, Sir Bedivere's last knightly act was to return what to a lake?",Excalibur,3.346,S,289.336,4.073,4.613,0.851,5.983,625.725129,3.959482792,13.67146429,NA1170,117,2,1,2,51,428,What element must be burned out of pig iron to make steel? ,Carbon,1.936,W,299.364,3.124,3.677,1.941,9.634,625.725129,3.458820157,13.67146429,11171,117,2,1,2,52,4,"Gem is the trade name for the most common, three-loop design of what?",The paper clip,54.323,W,312.535,4.339,4.881,54.328,63.22,625.725129,1.796396891,13.67146429,11172,117,2,1,2,53,620,"What pet bird takes its name from Australian Aborigine words for ""good eating""?",The budgerigar,43.303,S,377.638,2.899,3.443,2.207,6.168,625.725129,2.137891788,13.67146429,NA1173,117,2,1,2,54,114,"In 1849, Walter Hunt received a patent for turning a single piece of wire into what?",A paper clip,2.243,W,386.028,2.836,3.376,2.248,9.634,625.725129,3.711413484,13.67146429,11174,117,2,1,2,55,931,Who is pictured on a US Purple Heart medal? ,George Washington,13.755,S,399.45,2.462,3.009,0.725,4.245,625.725129,3.941315272,13.67146429,NA1175,117,2,1,2,56,117,"in 1908, New York City passed the Sullivan Ordinance which made it illegal for women to do what in public?",Smoke,2.64,W,407.723,2.725,3.276,2.645,9.935,625.725129,1.952549247,13.67146429,11176,117,2,1,2,57,413,What did Ross and Norris McWhirter compile as a promotional giveaway in 1955? ,The Guinness Book of World Records,6.641,S,419.691,2.357,2.925,1.031,4.462,625.725129,2.928476882,13.67146429,NA1177,117,2,1,2,58,498,What is an osier?,A willow twig ,2.064,W,427.162,1.286,1.838,2.068,7.912,625.725129,1.635094378,13.67146429,01178,117,2,1,2,59,697,What animal is combined with a serpent to make the mythical creature the Cockatrice? ,Rooster,22.649,S,436.79,2.979,3.527,22.267,26.308,625.725129,1.660292226,13.67146429,NA1179,117,2,1,2,60,352,What Blue Ridge peak in North Carolina is the highest point east of the Mississippi? ,Mount Mitchell,54.323,S,464.836,2.764,3.309,0.43,4.245,625.725129,1.611034368,13.67146429,NA1180,117,2,1,2,61,778,What's been released five times a year from January 1999 to fall 2008?,State quarters ,0.517,W,470.787,2.989,3.543,0.522,8.079,625.725129,2.027354644,13.67146429,11181,117,2,1,2,62,971,Who was the only U.S. president to have been married in the White House? ,Grover Cleveland ,3.551,W,480.966,2.107,2.658,3.556,10.219,625.725129,1.096661098,13.67146429,11182,117,2,1,2,63,769,"What word comes to us from the Greek for ""thick-skinned""?  ",Pachyderm,11.862,S,492.382,3.299,3.844,1.43,5.783,625.725129,3.908415005,13.67146429,NA1183,117,2,1,2,64,574,"What lagoon south of Queens, New York, is named for a local Indian tribe and has nothing to do Caribbean?",Jamaica Bay,34.446,W,502.16,4.481,5.031,34.451,43.498,625.725129,1.122135966,13.67146429,11184,117,2,1,2,65,225,Tasseomancy is a method of fortune telling that primarily uses what? ,Tea leaves,71.198,W,546.854,3.05,3.594,71.203,78.815,625.725129,1.491068107,13.67146429,11185,117,1,1,3,66,649,"What road, which names a 2002 film, divides Wayne County from affluent Oakland and Maycomb Counties?",8 Mile Road ,14.659,S,0.024,4.584,0.547,1.972,7.621,601.2488924,1.020096522,5.860073171,NA1186,117,1,1,3,67,966,Who was the only British Prime Minister to have been assassinated? ,Spencer Perceval ,5.991,W,8.748,2.675,0.551,5.997,13.228,601.2488924,3.210285657,5.860073171,01187,117,1,1,3,68,342,What athlete acted in the movie Old Yeller? ,Chuck Connors,10.066,S,25.262,1.425,0.547,1.108,3.593,601.2488924,1.539016317,5.860073171,NA1188,117,1,1,3,69,807,"When asked to define ""cool,"" what two words did James Brown use? ",James Brown,7.41,W,30.477,3.522,0.539,7.415,15.484,601.2488924,1.687775744,5.860073171,11189,117,1,1,3,70,275,"The SS Faith, a ship built by Leslie Comyn, was made of what unique material?",Cement,17.328,S,47.726,2.433,0.542,0.929,4.412,601.2488924,1.711006414,5.860073171,NA1190,117,1,1,3,71,596,"What name is shared by the rivers that run through Denison, TX and Hanoi, Vietnam?",Red River,12.913,S,53.927,2.656,0.57,0.854,4.596,601.2488924,1.597922579,5.860073171,NA1191,117,1,1,3,72,13,A causeway lined with hundreds of sphinxes once connected Karnak to what other great Egyptian temple?,Luxor,0.588,W,60.212,4.811,0.554,0.592,9.969,601.2488924,1.516443475,5.860073171,01192,117,1,1,3,73,985,"Whose doghouse apparently contains a basement, a pool table, an Andrew Wyeth painting, and a Jacuzzi?",Snoopy's,7.377,W,71.778,2.965,0.545,7.382,14.899,601.2488924,1.09740417,5.860073171,11193,117,1,1,3,74,460,What game show host took his stage name from the college in his West Virginia hometown? ,Peter Marshall,14.031,W,87.891,2.972,0.571,14.036,21.601,601.2488924,2.531862496,5.860073171,11194,117,1,1,3,75,389,What common aquarium fish is named for the naturalist who discovered it in Trinidad in 1876? ,The guppy,0.309,W,112.11,3.561,0.55,0.313,8.43,601.2488924,1.87550983,5.860073171,11195,117,1,1,3,76,829,"Which animal has tubular shaped eyeballs, which therefore cannot move?  ",Owl,18.719,W,122.506,4.47,0.545,18.723,27.753,601.2488924,2.350819545,5.860073171,11196,117,1,1,3,77,927,Who is Jason Schwartzman's famous mother?  ,Talia Shire ,9.621,S,152.692,2.643,0.549,0.842,4.546,601.2488924,3.1996043,5.860073171,NA1197,117,1,1,3,78,888,Which poisonous snake smells like fresh-cut cucumbers? ,Copperhead snake,6.066,S,160.514,2.669,0.54,0.827,4.546,601.2488924,2.524366643,5.860073171,NA1198,117,1,1,3,79,761,"What Washington Wizards All-Star still bears the misplaced ""w"" in his name from a birth certificate typo?",Antawn Jamison ,16.744,S,167.668,5.243,0.54,1.027,7.32,601.2488924,1.269972999,5.860073171,NA1199,117,1,1,3,80,317,What album spent a record 741 weeks on Billboard's Top 200 Albums chart? ,Dark Side of the Moon,15.197,W,176.343,2.792,0.551,15.202,22.554,601.2488924,1.99739429,5.860073171,01200,117,1,1,3,81,221,"Starfish belong to what animal phylum, whose name means ""spiny skin""? ",Echinoderms,15.103,S,200.98,2.747,0.545,1.118,4.93,601.2488924,2.634326858,5.860073171,NA1201,117,1,1,3,82,724,"What was originally sold in 1965 under the name ""Chemgrass""?  ",AstroTurf ,6.47,W,208.635,3.324,0.554,6.475,14.381,601.2488924,2.299609384,5.860073171,11202,117,1,1,3,83,1005,"Young wines are said to have ""aroma."" What do older wines have instead?",Bouquet,19.611,W,225.4,2.44,0.552,19.616,26.615,601.2488924,1.381250356,5.860073171,11203,117,1,1,3,84,422,What does a screever do on a sidewalk? ,Draw,0.163,W,253.48,2.384,0.541,0.168,7.11,601.2488924,1.782104549,5.860073171,01204,117,1,1,3,85,942,"Who performs the guest guitar solo on Michael Jackson's ""Beat It""?  ",Eddie Van Halen,17.523,S,262.472,2.383,0.542,2.834,6.268,601.2488924,2.40621471,5.860073171,NA1205,117,1,1,3,86,982,Whom did the Daughters of the American Revolution bar from singing at Constitution Hall in 1936?,Marian Anderson,11.057,S,271.23,2.929,0.547,1.58,5.565,601.2488924,3.850521312,5.860073171,NA1206,117,1,1,3,87,434,What European country is named for the dark-looking Dinaric Alps? ,Montenegro,6.488,W,280.724,2.691,0.551,6.493,13.745,601.2488924,2.359058338,5.860073171,11207,117,1,1,3,88,917,Who did Pope Gregory VII leave in the snow outside of his castle gates for three full days?  ,Holy Roman Emperor Henry IV ,3.648,W,296.904,3.032,0.545,3.654,11.238,601.2488924,3.501346448,5.860073171,11208,117,1,1,3,89,728,What was the 11th-century Spanish military leader Rodrigo Diaz de Vivar better known as?  ,El Cid ,9.862,S,311.729,2.006,0.551,0.984,4.061,601.2488924,3.996892583,5.860073171,NA1209,117,1,1,3,90,595,What name is given to an eagle's nest?   ,Aerie,15.969,W,319.869,1.154,0.567,15.974,21.702,601.2488924,1.68147645,5.860073171,11210,117,1,1,3,91,449,What fictional island is constantly at war with Blefuscu over the correct way to eat a boiled egg?,Lilliput,2.862,S,343.336,4.943,0.539,0.741,6.735,601.2488924,2.665575189,5.860073171,NA1211,117,1,1,3,92,979,"Who's the only character in ""Peter and the Wolf"" represented by a brass instrument?",The wolf (french horn),13.456,S,352.83,3.402,0.543,1.928,6.384,601.2488924,2.24223017,5.860073171,NA1212,117,1,1,3,93,406,What current branch of the U.S. military was a corps of only 50 soldiers when World War I broke out?,The U.S. Air Force,7.888,W,361.538,2.574,0.552,7.893,15.033,601.2488924,2.191387558,5.860073171,11213,117,1,1,3,94,576,"What late American's son, Rich, said in 2005, ""My father's name is synonymous with the word 'asterisk'?",Roger Maris,3.774,S,378.871,5.345,0.539,1.301,7.688,601.2488924,1.596521334,5.860073171,NA1214,117,1,1,3,95,556,What islands are home to most of the world's blue-footed boobies? ,The Galapagos Islands ,12.023,K,388.264,2.511,0.547,1.004,4.579,601.2488924,1.970968719,5.860073171,11215,117,1,1,3,96,542,What is the only type of lizard that has a voice? ,Gecko,19.175,W,394.916,2.747,0.546,19.18,26.482,601.2488924,1.994557552,5.860073171,11216,117,1,1,3,97,836,Which animals are born pregnant and can give birth 10 days after being born themselves?  ,Aphids,13.456,W,423.481,4.31,0.554,13.461,22.336,601.2488924,2.308095364,5.860073171,11217,117,1,1,3,98,285,"The world's first ""sister cities"" were what Spanish city and its midwestern namesake?",Toledo,10.405,W,448.202,3.237,0.54,10.41,18.191,601.2488924,1.225232412,5.860073171,11218,117,1,1,3,99,871,What is the only cat that cannot retract its claws? ,Cheetah,2.558,K,467.707,2.724,0.552,0.895,4.68,601.2488924,2.233547431,5.860073171,11219,117,1,1,3,100,504,What is measured in becquerels? ,Radioactivity,17.693,S,474.711,1.289,0.55,0.81,3.158,601.2488924,3.602125226,5.860073171,NA1220,117,1,1,3,101,511,What is the deepest point of the Mariana Trench?,Challenger Deep ,18.264,W,481.58,1.379,0.543,18.269,24.209,601.2488924,1.382379757,5.860073171,11221,117,1,1,3,102,672,What sports term is the shortest word ever to decide the National Spelling Bee?   ,Luge,9.357,W,507.287,2.736,0.54,9.362,16.654,601.2488924,3.885967484,5.860073171,11222,117,1,1,3,103,336,What area changed hands 72 times during the Civil War? ,Shenandoah Valley,12.561,S,527.895,3.688,0.541,0.922,5.666,601.2488924,1.363073709,5.860073171,NA1223,117,1,1,3,104,219,"Sodium azide, a highly toxic chemical, is best-known for being used to develop what lifesaving devices?",Air bags,5.391,W,535.033,5.135,0.548,5.396,15.083,601.2488924,1.405661103,5.860073171,11224,117,1,1,3,105,137,"In Europe, but not the U.S., what are measured in ""Paris Points""?",Shoe sizes,17.759,S,551.596,2.827,0.549,1.586,5.465,601.2488924,2.133306821,5.860073171,NA1225,117,1,1,3,106,560,What Kansan was the only Native American ever to serve as U.S. vice president? ,Charles Curtis,3.011,W,559.285,2.85,0.543,3.015,10.419,601.2488924,1.051578899,5.860073171,01226,117,1,1,3,107,751,"What was the one question Sigmund Freud said he was unable to answer, despite 30 years of research?",What do women want? ,9.066,W,570.835,3.093,0.551,9.071,16.721,601.2488924,2.831357005,5.860073171,11227,117,1,1,3,108,822,Where would you find the popular party resort of Magaluf?   ,Majorca,11.057,S,590.457,2.51,0.549,0.803,4.379,601.2488924,2.321223483,5.860073171,NA1228,117,1,1,3,109,753,What was the only children's story ever published by James Bond creator Ian Fleming? ,Chitty Chitty Bang Bang ,17.155,NA,597.227,NA,NA,NA,NA,601.2488924,3.410641816,5.860073171,NA1229,117,2,1,4,110,75,"Europe's only free-range monkeys are the Barbary apes, which live where?",Gibralter,68.712,S,0.035,2.591,3.142,1.24,4.897,643.231921,1.374133101,9.813424242,NA1230,117,2,1,4,111,400,"What country launched Europe's first super-high-speed passenger train, in 1981?",France,8.069,W,6.42,2.622,3.176,8.073,15.267,643.231921,1.788745043,9.813424242,11231,117,2,1,4,112,633,What president was shot while walking to California Governor Jerry Brown's office?  ,Gerald Ford ,12.635,W,23.552,3.314,3.861,12.64,20.515,643.231921,1.736160619,9.813424242,11232,117,2,1,4,113,863,'Which European country was the first to produce decaffeinated coffee? ','Germany',31.30430197,W,87.485,2.189,2.741,1.056,4.311,643.231921,3.726093753,9.813424242,11233,117,2,1,4,114,69,"'During which war was ""The African Queen"" set?'",'World War I',22.64912394,S,93.051,4.087,4.63,0.849,9.483,643.231921,1.160209793,9.813424242,NA1234,117,2,1,4,115,613,'What owner-bartender of Chicago''s Lone Star Saloon was famous for his drug-laced drinks? ','Mickey Finn',0.844434793,W,106.138,3.704,4.245,2.018,6.769,643.231921,3.517566791,9.813424242,01235,117,2,1,4,116,190,"'Of all the countries named for a person, which country is named for the person who lived most recently?'",'Bolivia',5.49296608,S,116.618,2.048,2.591,0.756,7.36,643.231921,3.604927867,9.813424242,NA1236,117,2,1,4,117,497,'What is an esker? ','A glacial ridge',0.751176402,W,126.045,2.957,3.51,1.679,5.699,643.231921,1.968261457,9.813424242,01237,117,2,1,4,118,987,"'Whose epitaph read in part, ""Here lies one whose name was writ in water?  '",'John Keats ',5.49296608,S,133.967,2.571,3.126,13.662,20.8,643.231921,2.140629326,9.813424242,NA1238,117,2,1,4,119,981,'Who''s the only U.S. president whose three initials spell a word? ','James A. Garfield',13.65653549,W,156.799,3.387,3.928,0.691,5.131,643.231921,1.938897208,9.813424242,11239,117,2,1,4,120,748,'What was the name of the plane Buddy Holly died in?  ','American Pie',64.40948018,S,163.217,4.249,4.797,9.251,18.058,643.231921,1.186130412,9.813424242,NA1240,117,2,1,4,121,552,"'What is unusual about the ""in God We Trust"" Motto on the U.S. Mint''s recent presidential dollar coins?'",'It''s stamped on the coin''s edge',9.244859195,W,183.057,1.985,2.54,1.028,4.078,643.231921,1.696659239,9.813424242,11241,117,2,1,4,122,745,'What was the most expensive drawing ever sold?  ','Danseuse au Repos by Edgar Degas',31.30430197,S,190.495,3.131,3.677,5.498,13.194,643.231921,3.267092649,9.813424242,NA1242,117,2,1,4,123,364,"'What bulb vegetable is traditionally worn on Saint David''s Day, as it is a national symbol of Wales?'",'The Leek ',5.49296608,W,206.775,2.843,3.393,0.047,7.444,643.231921,2.999778454,9.813424242,11243,117,2,1,4,124,734,'What was the first English play to be written especially for children? ','Peter Pan ',0.041960305,W,216.168,4.578,5.131,30.128,39.269,643.231921,1.87797257,9.813424242,11244,117,2,1,4,125,802,"'What''s the only TV show to top the Nielsen ratings five seasons in a row, from 1972 to 1976?  '",'All in the Family ',30.12326689,W,259.04,2.178,2.724,5.125,8.357,643.231921,3.522946736,9.813424242,11245,117,2,1,4,126,631,"'What port, its state''s largest city, is nicknamed the Brick City? '","'Newark, NJ '",10.39548239,S,270.757,1.501,2.055,0.485,6.558,643.231921,3.264867166,9.813424242,NA1246,117,2,1,4,127,834,"'Which animal''s poison could kill up to 2,200 people? '",'Poison-arrow frog',0.479460433,W,279.883,2.607,3.159,0.423,4.094,643.231921,2.496392764,9.813424242,11247,117,2,1,4,128,250,'The fictional nation of Brobdingnag from Gulliver''s Travels is presumed to be where?','Near Alaska',2.643929456,S,286.536,2.098,2.641,1.345,4.495,643.231921,2.479831287,9.813424242,NA