,ID,C_Environment,C_Condition,C_Cycle,C_Trial,C_QuestionNum,C_Question,C_Answer,C_AssignedWait,C_Response,C_QPresent,C_StartRT,C_WaitStart,C_WaitTime,C_TrialLength,C_CycleLength,C_Jitter,C_AverageWait,MC_Correct3430,111,2,1,4,129,433,What EU nation was once led by a president and a prime minister who were identical twins? ,Poland,1.191,W,423.004,4.087,4.63,1.196,9.835,602.675116,2.502861147,12.09257692,13431,111,2,1,4,130,761,"What Washington Wizards All-Star still bears the misplaced ""w"" in his name from a birth certificate typo?",Antawn Jamison ,14.902,W,435.406,5.069,5.616,14.907,24.527,602.675116,3.007973952,12.09257692,13432,111,2,1,4,131,819,Where is the only royal palace in the United States? ,Hawaii,50.554,W,463.001,4.026,4.58,50.559,59.142,602.675116,3.763533903,12.09257692,03433,111,2,1,4,132,389,What common aquarium fish is named for the naturalist who discovered it in Trinidad in 1876? ,The guppy,5.928,S,525.964,4.808,5.349,0.394,6.251,602.675116,2.50982449,12.09257692,NA3434,111,2,1,4,133,484,What instrument was invented to sound like a human singing? ,Violin,28.487,W,534.789,2.526,3.075,28.491,35.574,602.675116,2.99791922,12.09257692,03435,111,2,1,4,134,85,Greeks consider which day of the week the unluckiest because it is the day that Constantinople fell in 1453? ,Tuesday,2.991,S,573.416,3.908,4.463,0.252,5.232,602.675116,3.345186356,12.09257692,NA3436,111,2,1,4,135,335,"What are you trying to remember if you use the mnemonic ""HOMES""?  ",The names of the Great Lakes ,12.214,K,582.057,5.322,5.867,0.359,6.738,602.675116,1.203226007,12.09257692,13437,111,2,1,4,136,115,"In 1893, who became the first woman ever to appear on a U.S. postage stamp?",Queen Isabella I ,0.194,W,590.063,2.548,3.092,0.199,7.293,602.675116,1.764212941,12.09257692,03438,111,2,1,4,137,431,What English dynasty collapsed in the Wars of the Roses?  ,The Plantagenets,0.721,NA,599.189,NA,NA,NA,NA,602.675116,1.687496184,12.09257692,NA3439,110,2,2,1,1,769,"What word comes to us from the Greek for ""thick-skinned""?  ",Pachyderm,6.971,W,0.234,6.014,0.538,6.988,17.56,603.4358972,2.418396518,8.65925,03440,110,2,2,1,2,641,What reference classic is still named for the defunct New York newspaper that first published it in 1868?,The World Almanac and Book of Facts,4.306,W,20.292,5.93,0.555,4.313,14.815,603.4358972,2.857494761,8.65925,03441,110,2,2,1,3,664,What snack food is an ingredient in the explosive dynamite?  ,Peanuts ,32.614,W,38.025,2.972,0.555,32.619,40.154,603.4358972,2.120892393,8.65925,13442,110,2,2,1,4,4,"Gem is the trade name for the most common, three-loop design of what?",The paper clip,0.276,W,80.362,5.596,0.555,0.281,10.437,603.4358972,3.414463322,8.65925,13443,110,2,2,1,5,852,Which Constitutional Amendment deals with poll taxes? ,Twenty-fourth ,0.265,W,94.269,2.616,0.543,0.27,7.444,603.4358972,2.622627755,8.65925,03444,110,2,2,1,6,6,Project Kansas was the name for the top secret 1985 attempt to revamp what product?,Coca-Cola,20.827,S,104.398,5.791,0.544,6.065,12.921,603.4358972,1.921241124,8.65925,NA3445,110,2,2,1,7,298,"Until 1790, what was known as Jenkins Hill? ",Capitol Hill,3.411,S,119.307,3.45,0.545,2.143,6.652,603.4358972,2.148080231,8.65925,NA3446,110,2,2,1,8,20,"According to Norse sagas, who gave Greenland its misleading name in order to attract settlers? ",Eric the Red,48.237,S,128.182,5.334,0.549,2.314,8.725,603.4358972,2.726557479,8.65925,NA3447,110,2,2,1,9,225,Tasseomancy is a method of fortune telling that primarily uses what? ,Tea leaves,38.848,S,139.698,4.418,0.546,24.117,29.601,603.4358972,3.608004556,8.65925,NA3448,110,2,2,1,10,284,"The word serendipity comes from Serendip, the Persian name for what island? ",Sri Lanka,4.504,W,172.977,4.486,0.545,4.51,13.562,603.4358972,2.69443459,8.65925,03449,110,2,2,1,11,957,Who was sent to the electric chair on the testimony of her brother David Greenglass?,Ether Rosenberg ,1.769,W,189.29,5.283,0.55,1.774,11.622,603.4358972,2.231419244,8.65925,03450,110,2,2,1,12,710,What U.S. state's civil law is most closely based on the Napoleonic Code?  ,Louisiana's,18.495,S,203.213,3.424,0.554,2.941,7.437,603.4358972,2.303159826,8.65925,NA3451,110,2,2,1,13,795,What's the only country to have hosted a Summer Olympics in which it didn't win a single medal?   ,Canada,49.687,W,213.041,5.916,0.552,49.692,60.178,603.4358972,1.69249566,8.65925,13452,110,2,2,1,14,289,"Thimpu, the capital of Bhutan, is known for being the only world capital without any what?",Traffic lights,0.073,W,274.967,5.182,0.551,0.078,9.817,603.4358972,3.398859411,8.65925,13453,110,2,2,1,15,925,Who invented condensed milk in 1856? ,"Gail Borden, Jr. ",9.953,S,288.238,1.878,0.545,1.59,4.529,603.4358972,1.103365549,8.65925,NA3454,110,2,2,1,16,158,"In what layer of the Earth's atmosphere is Antarctica's famed ""ozone hole""? ",Stratosphere,2.943,K,293.938,6.043,0.543,0.921,8.025,603.4358972,3.797776241,8.65925,03455,110,2,2,1,17,208,"Pink Floyd's ""Chapter 24"" was inspired by what literary work?",The I Ching,11.734,S,305.822,3.295,0.549,0.946,5.298,603.4358972,2.819818528,8.65925,NA3456,110,2,2,1,18,480,What imports from a Baja California beach made Gary Drahl a millionaire in late 1975?,Pet Rocks,50.384,S,314.012,4.841,0.541,32.362,38.259,603.4358972,3.10374711,8.65925,NA3457,110,2,2,1,19,906,Who beat Robert Scott by a month in his expedition to the South Pole? ,Roald Amundsen ,4.836,S,355.447,2.598,0.544,1.095,4.746,603.4358972,1.704366153,8.65925,NA3458,110,2,2,1,20,557,What Italian physician was the first to describe the way the ovaries connect to the uterus in humans?,Gabriele Falloppio ,1.196,W,361.965,5.807,0.544,1.201,11.555,603.4358972,2.98208817,8.65925,03459,110,2,2,1,21,871,What is the only cat that cannot retract its claws? ,Cheetah,8.375,W,376.557,2.76,0.55,8.38,15.701,603.4358972,2.995761133,8.65925,13460,110,2,2,1,22,428,What element must be burned out of pig iron to make steel? ,Carbon,55.208,S,395.31,4.038,0.541,11.186,16.279,603.4358972,1.392346521,8.65925,NA3461,110,2,2,1,23,253,The first suburban shopping center in the U.S. was established in what city?,Kansas City ,1.963,W,413.044,2.921,0.539,1.968,9.433,603.4358972,1.451229502,8.65925,13462,110,2,2,1,24,811,"Where did the abbreviation ""INRI"" traditionally appear? ",On Christ's crucifix ,4.504,S,423.992,3.229,0.549,4.203,8.49,603.4358972,1.491469414,8.65925,NA3463,110,2,2,1,25,768,"What whiskey cocktail lends its name to the short glass also called a ""lowball""?",The old-fashioned,49.687,S,434.104,6.228,0.541,14.722,21.996,603.4358972,2.087336492,8.65925,NA3464,110,2,2,1,26,473,What city's harbor is overlooked by Victoria Peak? ,Hong Kong ,10.119,S,458.273,2.363,0.528,9.359,12.769,603.4358972,2.347787595,8.65925,NA3465,110,2,2,1,27,744,What was the magical original name of the online bookstore that changed its name in 1995 to Amazon.com?,Cadabra.com ,5.194,K,473.466,4.794,0.554,0.445,6.301,603.4358972,2.997991344,8.65925,13466,110,2,2,1,28,747,What was the name of the American actress who was first to appear on a postage stamp?  ,Grace Kelly ,0.581,W,482.826,3.554,0.541,0.586,8.698,603.4358972,1.218563453,8.65925,13467,110,2,2,1,29,49,"Because his father was from Minorca, in Spain, what Civil War hero was the U.S. Navy's first Hispanic admiral?",David Farragut,1.118,W,492.805,4.648,0.55,1.123,10.336,603.4358972,1.907470642,8.65925,03468,110,2,2,1,30,910,"Who christened Hawaii ""the Sandwich Islands"" in 1778?  ",Captain Cook ,3.887,S,505.123,2.857,0.552,2.975,6.902,603.4358972,1.053268138,8.65925,NA3469,110,2,2,1,31,969,Who was the only U.S. president to also hold a patent for an invention?,Abraham Lincoln,7.493,K,513.146,2.666,0.543,1.616,5.331,603.4358972,3.673818678,8.65925,03470,110,2,2,1,32,110,In 1568 the Catholic Church sentenced the entire population of which nation to death as heretics?,The Netherlands,27.386,W,522.222,4.295,0.553,27.391,36.243,603.4358972,3.692014128,8.65925,13471,110,2,2,1,33,496,What is an adit?  ,A mine shaft passage,55.208,S,562.219,2.337,0.554,3.701,7.104,603.4358972,1.520789408,8.65925,NA3472,110,2,2,1,34,190,"Of all the countries named for a person, which country is named for the person who lived most recently?",Bolivia,14.249,W,570.91,2.838,0.555,14.253,21.651,603.4358972,2.316949052,8.65925,13473,110,2,2,1,35,14,A conference on safety held at Columbia University's Teacher College in 1939 led to what change? ,School buses were painted yellow,2.712,S,594.946,3.683,0.546,1.95,6.686,603.4358972,1.753875492,8.65925,NA3474,110,1,2,2,36,493,What is a nene?,A Hawaiian goose,9.255,S,0.033,4.717,0.548,8.737,14.526,604.9635619,1.82479785,6.317230769,NA3475,110,1,2,2,37,585,What metal was found in Nevada's famed Comstock Lode?  ,Silver,15.222,S,16.446,2.397,0.545,4.406,7.855,604.9635619,1.837814295,6.317230769,NA3476,110,1,2,2,38,642,What restaurant chain was the brainchild of Atari founder Nolan Bushnell? ,Chuck E. Cheese's,0.731,W,26.208,4.252,0.545,0.737,9.551,604.9635619,2.176750778,6.317230769,03477,110,1,2,2,39,400,"What country launched Europe's first super-high-speed passenger train, in 1981?",France,9.386,W,37.991,4.453,0.545,9.391,18.392,604.9635619,1.896538961,6.317230769,13478,110,1,2,2,40,185,Mohammed Khatami is both a former national librarian and a former president of what nation?,Iran,13.918,S,58.349,2.198,0.543,1.265,4.512,604.9635619,3.701893152,6.317230769,NA3479,110,1,2,2,41,761,"What Washington Wizards All-Star still bears the misplaced ""w"" in his name from a birth certificate typo?",Antawn Jamison ,11.464,S,66.639,3.556,0.539,2.788,7.387,604.9635619,2.27161772,6.317230769,NA3480,110,1,2,2,42,216,"Shakespeare mentioned his wife only once in his will, making her the odd bequest of his ""second best"" what? ",Bed ,4.921,W,76.367,6.556,0.547,4.926,16.035,604.9635619,1.432291429,6.317230769,13481,110,1,2,2,43,966,Who was the only British Prime Minister to have been assassinated? ,Spencer Perceval ,6.768,W,93.9,1.959,0.548,6.773,13.295,604.9635619,1.833856957,6.317230769,03482,110,1,2,2,44,389,What common aquarium fish is named for the naturalist who discovered it in Trinidad in 1876? ,The guppy,17.548,W,109.094,4.333,0.547,17.552,26.448,604.9635619,3.572449715,6.317230769,13483,110,1,2,2,45,613,What owner-bartender of Chicago's Lone Star Saloon was famous for his drug-laced drinks? ,Mickey Finn,7.292,S,139.18,3.392,0.553,3.503,7.956,604.9635619,1.917048872,6.317230769,NA3484,110,1,2,2,46,406,What current branch of the U.S. military was a corps of only 50 soldiers when World War I broke out?,The U.S. Air Force,2.684,W,149.141,3.878,0.551,2.689,11.121,604.9635619,1.727709502,6.317230769,13485,110,1,2,2,47,833,Which animal's milk does not curdle? ,Camel,19.326,W,162.045,1.375,0.547,19.331,25.262,604.9635619,1.23279841,6.317230769,13486,110,1,2,2,48,821,Where would you find the countries of Qumar and Equatorial Kundu? ,On TV's The West Wing ,12.385,S,188.604,2.336,0.539,0.428,3.81,604.9635619,2.181173571,6.317230769,NA3487,110,1,2,2,49,658,What singer took his stage name from a Dublin hearing aid billboard?  ,Bono ,0.156,W,194.671,2.492,0.533,0.16,7.193,604.9635619,3.315286555,6.317230769,03488,110,1,2,2,50,409,What did Coleco name its 1983 home computer in the hope that it would take a bite out of Apple's sales?,Adam,12.182,W,205.234,5.593,0.541,12.187,22.354,604.9635619,3.982475494,6.317230769,13489,110,1,2,2,51,981,Who's the only U.S. president whose three initials spell a word? ,James A. Garfield,18.802,W,231.626,6.049,0.553,18.808,29.423,604.9635619,1.571208372,6.317230769,03490,110,1,2,2,52,84,Gamophobia is the fear of what?,Marriage,8.85,W,262.698,1.721,0.552,8.855,15.133,604.9635619,2.459168529,6.317230769,13491,110,1,2,2,53,335,"What are you trying to remember if you use the mnemonic ""HOMES""?  ",The names of the Great Lakes ,18.367,W,280.365,3.814,0.548,18.372,26.766,604.9635619,2.097903515,6.317230769,13492,110,1,2,2,54,434,What European country is named for the dark-looking Dinaric Alps? ,Montenegro,9.73,S,309.297,3.29,0.555,4.253,8.607,604.9635619,2.019329503,6.317230769,NA3493,110,1,2,2,55,449,What fictional island is constantly at war with Blefuscu over the correct way to eat a boiled egg?,Lilliput,12.385,S,319.995,4.264,0.549,2.506,7.838,604.9635619,1.18852626,6.317230769,NA3494,110,1,2,2,56,292,"Though the rest of him lies in Westminster Abbey, what writer's heart is buried near his native Dorchester?",Thomas Hardy,1.003,W,329.087,7.532,0.541,1.008,13.093,604.9635619,1.824978495,6.317230769,03495,110,1,2,2,57,979,"Who's the only character in ""Peter and the Wolf"" represented by a brass instrument?",The wolf (french horn),18.904,S,344.063,2.588,0.554,4.397,8.056,604.9635619,3.013363196,6.317230769,NA3496,110,1,2,2,58,982,Whom did the Daughters of the American Revolution bar from singing at Constitution Hall in 1936?,Marian Anderson,11.836,S,355.195,4.28,0.55,1.817,7.154,604.9635619,3.230616141,6.317230769,NA3497,110,1,2,2,59,87,Har Gobind Khorana won the 1968 Nobel Prize for Medicine for research into what?,Genetics,9.054,W,365.641,2.754,0.539,9.058,16.37,604.9635619,3.915250972,6.317230769,13498,110,1,2,2,60,888,Which poisonous snake smells like fresh-cut cucumbers? ,Copperhead snake,5.314,W,385.983,1.916,0.541,5.319,11.789,604.9635619,1.477440618,6.317230769,13499,110,1,2,2,61,396,"What can be built by the largest Lego set ever sold, a 5195-piece monstrosity? ",The Millenium Falcon ,1.957,W,399.304,4.259,0.555,1.962,10.787,604.9635619,1.937759569,6.317230769,03500,110,1,2,2,62,114,"In 1849, Walter Hunt received a patent for turning a single piece of wire into what?",A paper clip,16.081,S,412.091,4.04,0.539,10.796,15.895,604.9635619,3.538002954,6.317230769,NA3501,110,1,2,2,63,60,Challenger Astronaut Bruce McCandless II became Earth's first human to ever do what?,Untethered space walk,9.285,W,431.613,2.638,0.554,9.291,16.487,604.9635619,1.198962491,6.317230769,13502,110,1,2,2,64,857,Which country has the most public libraries?  ,Russia,12.023,W,449.364,1.543,0.546,12.027,18.124,604.9635619,2.800700582,6.317230769,13503,110,1,2,2,65,739,What was the first song ever performed in outer space? ,Happy Birthday,12.182,W,470.357,3.062,0.548,12.187,19.813,604.9635619,2.320060005,6.317230769,13504,110,1,2,2,66,718,What was developed thanks to Christian Hulsmeyer's 1904 invention of the telemobiloscope?  ,Radar,19.326,S,492.553,3.138,0.539,1.228,5.415,604.9635619,3.901877896,6.317230769,NA3505,110,1,2,2,67,971,Who was the only U.S. president to have been married in the White House? ,Grover Cleveland ,9.155,W,501.93,1.818,0.539,9.16,15.534,604.9635619,1.502405175,6.317230769,03506,110,1,2,2,68,932,Who is Rashida Jones's famous mother?,Peggy Lipton ,0.827,S,519.029,2.015,0.543,0.625,3.693,604.9635619,2.202346907,6.317230769,NA3507,110,1,2,2,69,822,Where would you find the popular party resort of Magaluf?   ,Majorca,12.376,S,524.995,1.96,0.548,6.916,9.929,604.9635619,2.800909193,6.317230769,NA3508,110,1,2,2,70,52,"Before his ears were cut off in 1990 by a political rival, what nation was ruled by dictator Samuel Doe?",Liberia,3.076,W,537.799,4.732,0.549,3.08,12.375,604.9635619,2.641179992,6.317230769,03509,110,1,2,2,71,698,What element is combined with oxygen to make up the mineral quartz?,Silicon,7.69,W,552.875,3.592,0.553,7.694,15.852,604.9635619,2.773797495,6.317230769,13510,110,1,2,2,72,948,"Who solves crimes in Bayport, located on Barmet Bay? ",The Hardy Boys ,15.222,S,571.662,4.781,0.551,0.489,6.335,604.9635619,1.139647886,6.317230769,NA3511,110,1,2,2,73,24,"According to Thomas Malory, Sir Bedivere's last knightly act was to return what to a lake?",Excalibur,18.28,S,579.2,2.691,0.551,0.384,4.145,604.9635619,2.902560543,6.317230769,NA3512,110,1,2,2,74,72,"Each year, approximately 125 people die of what? ",Choking on food,9.791,S,586.32,1.867,0.54,1.267,4.178,604.9635619,1.187588062,6.317230769,NA3513,110,1,2,2,75,270,"The pinna is the outer, visible part of what?",The ear,2.174,K,591.752,3.435,0.543,0.624,5.116,604.9635619,2.950810782,6.317230769,13514,110,1,2,2,76,604,"What noisy word comes from the capital of Hell in Milton's ""Paradise Lost""? ",Pandemonium,12.689,NA,599.892,NA,NA,NA,NA,604.9635619,1.070780171,6.317230769,NA3515,110,2,2,3,77,545,What is the second oldest continuously held American sporting event?  ,Westminster Kennel Club dog show ,9.927,W,0.03,4.03,0.55,9.932,18.527,602.1433849,1.28568603,7.878638889,03516,110,2,2,3,78,887,Which person has been awarded the most Oscars ever? ,Walt Disney,2.038,W,19.903,2.82,0.539,2.043,9.417,602.1433849,2.319655229,7.878638889,03517,110,2,2,3,79,88,Harry Truman was the first U.S. president of what religious persuasion? ,Southern Baptist,3.561,W,31.703,2.732,0.544,3.566,10.854,602.1433849,1.227752873,7.878638889,13518,110,2,2,3,80,231,The Admiral is which type of insect? ,Butterfly,74.452,S,43.838,2.406,0.553,25.255,28.731,602.1433849,3.921326984,7.878638889,NA3519,110,2,2,3,81,882,Which of Henry VIII's wives is buried next to him?  ,Jane Seymour ,13.9,S,76.581,1.854,0.553,12.231,15.143,602.1433849,3.566831938,7.878638889,NA3520,110,2,2,3,82,985,"Whose doghouse apparently contains a basement, a pool table, an Andrew Wyeth painting, and a Jacuzzi?",Snoopy's,0.373,W,95.368,4.468,0.547,0.377,9.4,602.1433849,1.84019548,7.878638889,13521,110,2,2,3,83,649,"What road, which names a 2002 film, divides Wayne County from affluent Oakland and Maycomb Counties?",8 Mile Road ,2.241,W,106.684,4.976,0.54,2.246,11.791,602.1433849,1.180846706,7.878638889,13522,110,2,2,3,84,855,Which country did the Easter Bunny originate from? ,Germany,22.172,W,119.721,2.683,0.543,22.176,29.407,602.1433849,2.371956846,7.878638889,13523,110,2,2,3,85,429,What element name is controversial because it was named for its codiscoverer when he was still living in 1994?,Seaborgium ,38.848,S,151.562,5.626,0.541,8.81,15.493,602.1433849,2.824006433,7.878638889,NA3524,110,2,2,3,86,973,Who won the Nobel Peace Prize in 1964? ,Martin Luther King Jr. ,2.535,W,169.947,1.696,0.544,2.54,8.798,602.1433849,1.932944419,7.878638889,03525,110,2,2,3,87,322,What animal lives in a holt? ,An otter,19.764,S,180.745,1.851,0.539,11.988,14.892,602.1433849,1.205216578,7.878638889,NA3526,110,2,2,3,88,802,"What's the only TV show to top the Nielsen ratings five seasons in a row, from 1972 to 1976?  ",All in the Family ,1.207,W,196.908,4.2,0.563,1.212,9.984,602.1433849,1.725681599,7.878638889,13527,110,2,2,3,89,784,What's the more common name for the retinal scotoma caused by the optic nerve? ,Your blind spot,59.752,S,208.675,8.537,0.538,5.317,14.908,602.1433849,1.446665078,7.878638889,NA3528,110,2,2,3,90,578,"What Latin American dictator was called ""Carepina""- ""Pineapple Face""- because of his acne scarred complextion?",Manuel Noriega ,2.712,W,225.105,4.147,0.549,2.716,11.422,602.1433849,1.102477303,7.878638889,03529,110,2,2,3,91,831,Which animal was named for what was wrongly thought to be its country of origin? ,Turkey,1.536,W,237.691,5.305,0.545,1.541,11.405,602.1433849,1.188244273,7.878638889,13530,110,2,2,3,92,113,"In 1802, John Beckley became the librarian of what collection containing 740 books at the time?",Library of Congress,9.953,S,250.343,4.709,0.556,2.115,7.888,602.1433849,1.348151565,7.878638889,NA3531,110,2,2,3,93,436,"What event was won by the same team the first twenty-five times it was held, from 1851 to 1983?  ",The America's Cup ,20.277,W,259.67,4.806,0.543,20.282,29.641,602.1433849,3.756140214,7.878638889,13532,110,2,2,3,94,486,"What invention should have made Ts'ai Lun, a second-century inventor, a household name? ",Paper,75.765,S,293.132,3.784,0.545,3.286,8.122,602.1433849,2.164353318,7.878638889,NA3533,110,2,2,3,95,432,What English word comes from the name of a hot spring in Iceland's Haukadalur valley? ,Geyser,4.246,S,303.578,2.674,0.552,1.135,4.88,602.1433849,1.404776363,7.878638889,NA3534,110,2,2,3,96,18,About half of the population of what Pacific island has the surname Christian?,Pitcairn Island,0.321,W,309.93,4.746,0.552,0.326,9.633,602.1433849,2.020570408,7.878638889,03535,110,2,2,3,97,9,"""White Christmas"" playing on Armed Forces Radio was the secret signal for what event on April 30, 1975?",The evacuation of Saigon,4.857,W,321.646,5.263,0.554,4.862,14.699,602.1433849,1.4980537,7.878638889,13536,110,2,2,3,98,748,What was the name of the plane Buddy Holly died in?  ,American Pie,0.49,W,337.909,2.038,0.552,0.495,7.093,602.1433849,1.372672225,7.878638889,13537,110,2,2,3,99,227,"The ""Mohorovicic discontinuity"" divides what two outer layers of the earth?",The crust and the mantle,26.177,S,346.45,2.017,0.557,1.731,4.813,602.1433849,1.107788885,7.878638889,NA3538,110,2,2,3,100,992,"Whose remains were thrown in the Seine River on May 30, 1431? ",Joan of Arc's ,7.883,W,352.451,3.073,0.554,7.888,15.534,602.1433849,1.787723458,7.878638889,13539,110,2,2,3,101,749,What was the name of William Shakespeare''s wife?  ,Anne Hathaway,1.196,W,369.834,1.594,0.545,1.201,7.344,602.1433849,1.381956902,7.878638889,13540,110,2,2,3,102,484,What instrument was invented to sound like a human singing? ,Violin,68.552,S,378.625,4.17,0.543,33.84,39.061,602.1433849,2.118211511,7.878638889,NA3541,110,2,2,3,103,633,What president was shot while walking to California Governor Jerry Brown''s office?  ,Gerald Ford ,5.615,W,419.876,3.487,0.541,5.619,13.662,602.1433849,2.025730385,7.878638889,03542,110,2,2,3,104,237,"The average male spends 2,965 hours doing what over the course of his lifetime?",Shaving,16.17,W,439.298,2.969,0.541,16.175,23.69,602.1433849,1.075469229,7.878638889,13543,110,2,2,3,105,342,What athlete acted in the movie Old Yeller? ,Chuck Connors,0.095,W,464.119,2.541,0.551,0.01,7.211,602.1433849,3.247844673,7.878638889,03544,110,2,2,3,106,951,Who was assassinated by Carl Weiss?  ,Huey Long,38.397,S,474.632,1.388,0.551,4.128,6.585,602.1433849,3.339502084,7.878638889,NA3545,110,2,2,3,107,602,What New York country club lent its name to the kind of dinner jacket first worn there in 1886?  ,Tuxedo Club ,19.621,W,484.627,3.392,0.552,19.625,27.584,602.1433849,1.753723403,7.878638889,13546,110,2,2,3,108,853,Which Constitutional Amendment deals with income tax? ,Sixteenth,5.03,W,514.044,1.495,0.544,5.035,11.088,602.1433849,2.791552508,7.878638889,13547,110,2,2,3,109,917,Who did Pope Gregory VII leave in the snow outside of his castle gates for three full days?  ,Holy Roman Emperor Henry IV ,4.246,W,528.001,2.787,0.539,4.251,11.589,602.1433849,1.763597674,7.878638889,03548,110,2,2,3,110,560,What Kansan was the only Native American ever to serve as U.S. vice president? ,Charles Curtis,14.278,S,541.473,2.795,0.548,8.004,11.869,602.1433849,3.510931166,7.878638889,NA3549,110,2,2,3,111,130,"In 2005, Bhutan became the first country to entirely ban what?",Tobacco,47.556,S,556.917,2.079,0.545,30.118,33.261,602.1433849,1.404383397,7.878638889,NA3550,110,2,2,3,112,941,Who outgrew a childhood chlorine allergy to become the biggest Olympic medal winner in Australian history? ,Ian Thorpe ,1.55,W,591.649,3.131,0.546,1.555,9.249,602.1433849,1.200856911,7.878638889,03551,110,1,2,4,113,499,"What is believed to have received its name from the Portuguese word for ""simpleton""? ",The dodo,11.723,W,0.0295,4.901,0.548,11.734,21.2,612.1674511,3.099144791,7.926305556,13552,110,1,2,4,114,931,Who is pictured on a US Purple Heart medal? ,George Washington,15.206,W,24.499,2.104,0.554,15.211,21.885,612.1674511,2.85317104,7.926305556,13553,110,1,2,4,115,286,"The world''s largest church is Our Lady of Peace Basilica in Yamoussoukro, what nation''s capital?",Ivory Coast's ,1.763,W,49.337,4.674,0.541,1.767,10.988,612.1674511,1.398967737,7.926305556,13554,110,1,2,4,116,734,What was the first English play to be written especially for children? ,Peter Pan ,9.449,W,61.789,2.99,0.553,9.454,17.004,612.1674511,1.202387775,7.926305556,03555,110,1,2,4,117,210,Prime Minister Lester Pearson won the Nobel Peace Prize for defusing what world crisis?,The Suez Crisis,19.189,W,80.058,3.161,0.549,19.194,26.916,612.1674511,1.67225095,7.926305556,03556,110,1,2,4,118,620,"What pet bird takes its name from Australian Aborigine words for ""good eating""?",The budgerigar,8.115,S,108.723,3.632,0.546,1.781,6.468,612.1674511,1.099745585,7.926305556,NA3557,110,1,2,4,119,465,What grapefruit-sized object has been reckoned to be the largest single cell on earth? ,An ostrich egg yolk ,2.937,W,116.361,3.738,0.541,2.942,11.239,612.1674511,1.24176319,7.926305556,13558,110,1,2,4,120,75,"Europe''s only free-range monkeys are the Barbary apes, which live where?",Gibralter,14.138,W,128.897,2.914,0.546,14.142,21.619,612.1674511,3.641721434,7.926305556,03559,110,1,2,4,121,895,Which state has the zip code 12345?,New York,8.425,W,154.252,1.918,0.555,8.431,14.932,612.1674511,2.516951662,7.926305556,13560,110,1,2,4,122,987,"Whose epitaph read in part, ""Here lies one whose name was writ in water? ",John Keats ,18.331,S,171.786,2.921,0.555,17.876,21.862,612.1674511,1.235327862,7.926305556,NA3561,110,1,2,4,123,547,What is the surgical knife called an izmel used for? ,The circumcision at a bris ,4.271,S,194.952,3.099,0.544,1.519,5.665,612.1674511,2.952172056,7.926305556,NA3562,110,1,2,4,124,778,What''s been released five times a year from January 1999 to fall 2008?,State quarters ,11.519,W,203.643,4.904,0.562,11.524,20.999,612.1674511,1.022700548,7.926305556,13563,110,1,2,4,125,433,What EU nation was once led by a president and a prime minister who were identical twins? ,Poland,9.285,S,225.723,4.384,0.546,3.301,8.742,612.1674511,3.615578256,7.926305556,NA3564,110,1,2,4,126,13,A causeway lined with hundreds of sphinxes once connected Karnak to what other great Egyptian temple?,Luxor,19.326,S,238.141,4.558,0.54,0.419,6.034,612.1674511,1.978372289,7.926305556,NA